{
  "$schema": "https://json-schema.org/draft/2020-12/schema",
  "$id": "https://blogman.local/schemas/issue-23-reseal/blogman-local-preflight-candidate-v2.schema.json",
  "type": "object",
  "additionalProperties": false,
  "required": [
    "format",
    "state",
    "produced_at",
    "candidate_id",
    "lockfile",
    "migration_set_sha256",
    "runbook_sha256",
    "build",
    "tests",
    "reviews",
    "production_counters_all_zero"
  ],
  "properties": {
    "format": {
      "const": "blogman-local-preflight-candidate/v2"
    },
    "state": {
      "const": "sealed-local-only"
    },
    "produced_at": {
      "type": "string",
      "pattern": "^\\d{4}-\\d{2}-\\d{2}T\\d{2}:\\d{2}:\\d{2}\\.\\d{3}Z$"
    },
    "candidate_id": {
      "type": "string",
      "pattern": "^[a-f0-9]{40}$"
    },
    "lockfile": {
      "type": "object",
      "additionalProperties": false,
      "required": [
        "sha256",
        "wrangler",
        "opennextjs_cloudflare"
      ],
      "properties": {
        "sha256": {
          "type": "string",
          "pattern": "^[a-f0-9]{64}$"
        },
        "wrangler": {
          "type": "string",
          "pattern": "^\\d+\\.\\d+\\.\\d+$"
        },
        "opennextjs_cloudflare": {
          "type": "string",
          "pattern": "^\\d+\\.\\d+\\.\\d+$"
        }
      }
    },
    "migration_set_sha256": {
      "type": "string",
      "pattern": "^[a-f0-9]{64}$"
    },
    "runbook_sha256": {
      "type": "string",
      "pattern": "^[a-f0-9]{64}$"
    },
    "build": {
      "type": "object",
      "additionalProperties": false,
      "required": [
        "archive_sha256",
        "worker_sha256",
        "tree_manifest_sha256"
      ],
      "properties": {
        "archive_sha256": {
          "type": "string",
          "pattern": "^[a-f0-9]{64}$"
        },
        "worker_sha256": {
          "type": "string",
          "pattern": "^[a-f0-9]{64}$"
        },
        "tree_manifest_sha256": {
          "type": "string",
          "pattern": "^[a-f0-9]{64}$"
        }
      }
    },
    "tests": {
      "type": "object",
      "additionalProperties": false,
      "required": [
        "affected_phase_b",
        "static_gates",
        "open_next_build",
        "canonical_long_migration_runner"
      ],
      "properties": {
        "affected_phase_b": {
          "type": "object",
          "additionalProperties": false,
          "required": [
            "state",
            "passed",
            "failed"
          ],
          "properties": {
            "state": {
              "const": "passed"
            },
            "passed": {
              "type": "integer",
              "minimum": 1
            },
            "failed": {
              "const": 0
            }
          }
        },
        "static_gates": {
          "const": "passed"
        },
        "open_next_build": {
          "type": "object",
          "additionalProperties": false,
          "required": [
            "state",
            "static_pages"
          ],
          "properties": {
            "state": {
              "const": "passed"
            },
            "static_pages": {
              "type": "integer",
              "minimum": 1
            }
          }
        },
        "canonical_long_migration_runner": {
          "oneOf": [
            {
              "type": "object",
              "additionalProperties": false,
              "required": [
                "state",
                "reason"
              ],
              "properties": {
                "state": {
                  "const": "unverified"
                },
                "reason": {
                  "type": "string",
                  "minLength": 1
                }
              }
            },
            {
              "type": "object",
              "additionalProperties": false,
              "required": [
                "state",
                "passed",
                "failed"
              ],
              "properties": {
                "state": {
                  "const": "passed"
                },
                "passed": {
                  "const": 46
                },
                "failed": {
                  "const": 0
                }
              }
            }
          ]
        }
      }
    },
    "reviews": {
      "type": "object",
      "additionalProperties": false,
      "required": [
        "standards",
        "spec"
      ],
      "properties": {
        "standards": {
          "type": "object",
          "additionalProperties": false,
          "required": [
            "state",
            "blockers"
          ],
          "properties": {
            "state": {
              "const": "passed"
            },
            "blockers": {
              "const": 0
            }
          }
        },
        "spec": {
          "type": "object",
          "additionalProperties": false,
          "required": [
            "state",
            "blockers"
          ],
          "properties": {
            "state": {
              "const": "passed"
            },
            "blockers": {
              "const": 0
            }
          }
        }
      }
    },
    "production_counters_all_zero": {
      "const": true
    }
  }
}
